# smartctl: Control and Monitor Utility for SMART Disks
# smartctl [options] device
# https://www.smartmontools.org

# -j, --json[=cgiosuv]: Enables JSON output mode
# -q TYPE, --quietmode=TYPE: errorsonly, silent (See exit status), noserial
# -t TEST, --test=TEST: offline, short, long, etc

# --scan: Scans for devices and prints each device name, device type and protocol ([ATA],  [SCSI], [NVME]) info
# --scan-open: Same as --scan, but also tries to open each device before printing device info.  The device open may change the device type
#              due to autodetection (see  also  '-d test')

# -s VALUE, --smart=VALUE: Enables or disables SMART on device; on, off
# -o VALUE, --offlineauto=VALUE: Turn on offline data collection, which periodically updates certain SMART attributes
# -S VALUE, --saveauto=VALUE: Enable autosave of device vendor-specific attributes
smartctl -s on -o on -S on /dev/sda

# -a, --all: Prints all SMART information about the disk, or TapeAlert information about the tape drive or changer
# [ATA]: equivalent to '-H -i -c -A -l error -l selftest -l selective'
# [SCSI]: equivalent to '-H -i -A -l error -l selftest'
# {NVME]: equivalent to '-H -i -c -A -l error'

# -x, --xall: Prints all SMART and non-SMART information about the device
# [ATA]: equivalent to '-H -i -g all -g wcreorder -c -A -f brief -l xerror,error -l xselftest,selftest -l selective -l directory -l scttemp -l scterc -l devstat -l  defects  -l  sata‐phy'
# [SCSI]: equivalent to '-H -i -g all -A -l error -l selftest -l background -l sasphy'
# {NVME]: equivalent to '-H -i -c -A -l error'

# -H, --health: Prints the health status of the device or pending TapeAlert messages
# If the device reports failing health status, this means either that the device has already failed, or that it is predicting its own failure
# within the next 24 hours.
$ smartctl -H /dev/sda        // Or smartctl -H /dev/nvme0
=== START OF READ SMART DATA SECTION ===
SMART overall-health self-assessment test result: PASSED

# -c, --capabilities: [ATA] Prints only the generic SMART capabilities.
# [NVMe] Prints various NVMe device capabilities obtained from the Identify Controller and the Identify Namespace data structure.
$ smartctl -c /dev/sda
=== START OF READ SMART DATA SECTION ===
General SMART Values:
Offline data collection status:  (0x00)	Offline data collection activity
					was never started.
					Auto Offline Data Collection: Disabled.
Self-test execution status:      (   0)	The previous self-test routine completed
					without error or no self-test has ever 
					been run.
Total time to complete Offline 
data collection: 		(    0) seconds.
Offline data collection
capabilities: 			 (0x71) SMART execute Offline immediate.
					No Auto Offline data collection support.
					Suspend Offline collection upon new
					command.
					No Offline surface scan supported.
					Self-test supported.
					Conveyance Self-test supported.
					Selective Self-test supported.
SMART capabilities:            (0x0002)	Does not save SMART data before
					entering power-saving mode.
					Supports SMART auto save timer.
Error logging capability:        (0x01)	Error logging supported.
					General Purpose Logging supported.
Short self-test routine 
recommended polling time: 	 (   1) minutes.
Extended self-test routine
recommended polling time: 	 (   1) minutes.
Conveyance self-test routine
recommended polling time: 	 (   1) minutes.

$ smartctl -c /dev/nvme0
=== START OF INFORMATION SECTION ===
Firmware Updates (0x17):            3 Slots, Slot 1 R/O, no Reset required
Optional Admin Commands (0x000f):   Security Format Frmw_DL NS_Mngmt
Optional NVM Commands (0x001f):     Comp Wr_Unc DS_Mngmt Wr_Zero Sav/Sel_Feat
Maximum Data Transfer Size:         64 Pages
Warning  Comp. Temp. Threshold:     84 Celsius
Critical Comp. Temp. Threshold:     85 Celsius
Namespace 1 Features (0x02):        NA_Fields

Supported Power States
St Op     Max   Active     Idle   RL RT WL WT  Ent_Lat  Ex_Lat
 0 +     9.00W       -        -    0  0  0  0        5       5

Supported LBA Sizes (NSID 0x1)
Id Fmt  Data  Metadt  Rel_Perf
 0 +     512       0         0
 1 -    4096       0         0

# smartctl guesses the device type if possible.  If necessary, the '-d' option can be used to override this guess.
# -i, --info: For NVMe devices the information is obtained from the Identify Controller and the Identify Namespace data structure.
# -d TYPE, --device=TYPE: In case the tool cannot detect the type; auto, test, ata, scsi, nvme[,NSID], sat[,auto][,N]
$ smartctl -i /dev/sda
=== START OF INFORMATION SECTION ===
Device Model:     xxxx
Serial Number:    xxxx
Firmware Version: xxxx
User Capacity:    124,034,899,968 bytes [124 GB]
Sector Size:      512 bytes logical/physical
Rotation Rate:    Solid State Device
Device is:        Not in smartctl database [for details use: -P showall]
ATA Version is:   ACS-2 (minor revision not indicated)
SATA Version is:  SATA 3.1, 6.0 Gb/s (current: 6.0 Gb/s)
Local Time is:    xxxx
SMART support is: Available - device has SMART capability.
SMART support is: Enabled

$ smartctl -i /dev/nvme0
=== START OF INFORMATION SECTION ===
Model Number:                       xxxx
Serial Number:                      xxxx
Firmware Version:                   xxxx
PCI Vendor/Subsystem ID:            xxxx
IEEE OUI Identifier:                xxxx
Total NVM Capacity:                 960,197,124,096 [960 GB]
Unallocated NVM Capacity:           0
Controller ID:                      2
Number of Namespaces:               1
Namespace 1 Size/Capacity:          960,197,124,096 [960 GB]
Namespace 1 Utilization:            442,368 [442 KB]
Namespace 1 Formatted LBA Size:     512
Local Time is:                      xxxx

# -A, --attributes: [ATA] Prints only the vendor specific SMART Attributes.
# [NVMe] For NVMe devices the attributes are obtained from the SMART/Health Information log.
# The ATA standard defines a whole bunch of attributes that describe a device’s technical properties and manufacturers can add
# proprietary extensions. There may be some differences in the way the data are stored, see RAW_VALUE.
# The VALUE column has the current value, WORST has the worst measured value so far, and THRESH the factory threshold value.
# A current value equal to, or below, the threshold value indicates an error condition for the attribute in question.
# TYPE, attribute types: Old_age attributes are characteristic of a normal aging process.
#                        Attributes with a Pre-fail tag are more serious, as they indicate an imminent failure!
# UPDATED: Always -- online tests; Offline -- offline tests, interrupted if OS needs regular access to the disk
#          How SMART collect specified attributes
# While online and offline tests only col- lect data, the self-diagnosis test checks the electrical and mechanical characteristics
# of the device and the read throughput. Interrupted if OS needs regular access to the disk. If you prefer to disable the device
# for the duration of the test, you can spec- ify the -C option
# The test results in a self-test logfile, which can be displayed by specifying the -l selftest option
# WHEN_FAILED: e.g., FAILING_NOW if Reallocated_Sector_Ct is below the THRESH
$ smartctl -A /dev/sda
=== START OF READ SMART DATA SECTION ===
SMART Attributes Data Structure revision number: 1
Vendor Specific SMART Attributes with Thresholds:
ID# ATTRIBUTE_NAME          FLAG     VALUE WORST THRESH TYPE      UPDATED  WHEN_FAILED RAW_VALUE
  1 Raw_Read_Error_Rate     0x0000   100   100   000    Old_age   Offline      -       0
  5 Reallocated_Sector_Ct   0x0000   100   100   000    Old_age   Offline      -       0
  9 Power_On_Hours          0x0000   100   100   000    Old_age   Offline      -       1004
 12 Power_Cycle_Count       0x0000   100   100   000    Old_age   Offline      -       312
160 Unknown_Attribute       0x0000   100   100   000    Old_age   Offline      -       0
161 Unknown_Attribute       0x0000   100   100   000    Old_age   Offline      -       401
163 Unknown_Attribute       0x0000   100   100   000    Old_age   Offline      -       65
164 Unknown_Attribute       0x0000   100   100   000    Old_age   Offline      -       769429
165 Unknown_Attribute       0x0000   100   100   000    Old_age   Offline      -       235
166 Unknown_Attribute       0x0000   100   100   000    Old_age   Offline      -       134
167 Unknown_Attribute       0x0000   100   100   000    Old_age   Offline      -       185
168 Unknown_Attribute       0x0000   100   100   000    Old_age   Offline      -       20000
169 Unknown_Attribute       0x0000   100   100   000    Old_age   Offline      -       100
175 Program_Fail_Count_Chip 0x0000   100   100   000    Old_age   Offline      -       0
176 Erase_Fail_Count_Chip   0x0000   100   100   000    Old_age   Offline      -       0
177 Wear_Leveling_Count     0x0000   100   100   050    Old_age   Offline      -       1288
178 Used_Rsvd_Blk_Cnt_Chip  0x0000   100   100   000    Old_age   Offline      -       0
181 Program_Fail_Cnt_Total  0x0000   100   100   000    Old_age   Offline      -       0
182 Erase_Fail_Count_Total  0x0000   100   100   000    Old_age   Offline      -       0
192 Power-Off_Retract_Count 0x0000   100   100   000    Old_age   Offline      -       68
194 Temperature_Celsius     0x0000   100   100   000    Old_age   Offline      -       47
195 Hardware_ECC_Recovered  0x0000   100   100   000    Old_age   Offline      -       0
196 Reallocated_Event_Count 0x0000   100   100   016    Old_age   Offline      -       0
197 Current_Pending_Sector  0x0000   100   100   000    Old_age   Offline      -       0
198 Offline_Uncorrectable   0x0000   100   100   000    Old_age   Offline      -       0
199 UDMA_CRC_Error_Count    0x0000   100   100   050    Old_age   Offline      -       18
232 Available_Reservd_Space 0x0000   100   100   000    Old_age   Offline      -       100
241 Total_LBAs_Written      0x0000   100   100   000    Old_age   Offline      -       231766
242 Total_LBAs_Read         0x0000   100   100   000    Old_age   Offline      -       44980
245 Unknown_Attribute       0x0000   100   100   000    Old_age   Offline      -       769429

$ smartctl -A /dev/sda
=== START OF READ SMART DATA SECTION ===
SMART Attributes Data Structure revision number: 1
Vendor Specific SMART Attributes with Thresholds:
ID# ATTRIBUTE_NAME          FLAG     VALUE WORST THRESH TYPE      UPDATED  WHEN_FAILED RAW_VALUE
  5 Reallocated_Sector_Ct   0x0032   100   100   000    Old_age   Always       -       0
  9 Power_On_Hours          0x0032   100   100   000    Old_age   Always       -       15508
 12 Power_Cycle_Count       0x0032   100   100   000    Old_age   Always       -       176
170 Available_Reservd_Space 0x0033   100   100   010    Pre-fail  Always       -       0
171 Program_Fail_Count      0x0032   100   100   000    Old_age   Always       -       0
172 Erase_Fail_Count        0x0032   100   100   000    Old_age   Always       -       0
174 Unsafe_Shutdown_Count   0x0032   100   100   000    Old_age   Always       -       93
175 Power_Loss_Cap_Test     0x0033   100   100   010    Pre-fail  Always       -       18020 (251 2978)
183 SATA_Downshift_Count    0x0032   100   100   000    Old_age   Always       -       0
184 End-to-End_Error_Count  0x0033   100   100   090    Pre-fail  Always       -       0
187 Uncorrectable_Error_Cnt 0x0032   100   100   000    Old_age   Always       -       0
190 Case_Temperature        0x0022   070   068   000    Old_age   Always       -       30 (Min/Max 24/36)
192 Unsafe_Shutdown_Count   0x0032   100   100   000    Old_age   Always       -       93
194 Drive_Temperature       0x0022   100   100   000    Old_age   Always       -       39
197 Pending_Sector_Count    0x0012   100   100   000    Old_age   Always       -       0
199 CRC_Error_Count         0x003e   100   100   000    Old_age   Always       -       0
225 Host_Writes_32MiB       0x0032   100   100   000    Old_age   Always       -       110594
226 Workld_Media_Wear_Indic 0x0032   100   100   000    Old_age   Always       -       348
227 Workld_Host_Reads_Perc  0x0032   100   100   000    Old_age   Always       -       25
228 Workload_Minutes        0x0032   100   100   000    Old_age   Always       -       929674
232 Available_Reservd_Space 0x0033   100   100   010    Pre-fail  Always       -       0
233 Media_Wearout_Indicator 0x0032   100   100   000    Old_age   Always       -       0
234 Thermal_Throttle_Status 0x0032   100   100   000    Old_age   Always       -       0/0
241 Host_Writes_32MiB       0x0032   100   100   000    Old_age   Always       -       110594
242 Host_Reads_32MiB        0x0032   100   100   000    Old_age   Always       -       39332
243 NAND_Writes_32MiB       0x0032   100   100   000    Old_age   Always       -       174882

$ smartctl -A /dev/nvme0
=== START OF SMART DATA SECTION ===
SMART/Health Information (NVMe Log 0x02)
Critical Warning:                   0x00
Temperature:                        32 Celsius
Available Spare:                    100%
Available Spare Threshold:          10%
Percentage Used:                    1%
Data Units Read:                    94,743,934 [48.5 TB]
Data Units Written:                 77,091,691 [39.4 TB]
Host Read Commands:                 3,343,913,797
Host Write Commands:                353,186,385
Controller Busy Time:               3,059
Power Cycles:                       308
Power On Hours:                     14,062
Unsafe Shutdowns:                   214
Media and Data Integrity Errors:    0
Error Information Log Entries:      89
Warning  Comp. Temperature Time:    0
Critical Comp. Temperature Time:    0
Temperature Sensor 1:               32 Celsius


# -l TYPE, --log=TYPE: Prints various device logs
# error, selftest, selective, directory[,g|s], xerror[,N][,error], xselftest[,N][,selftest], background, sasphy[,reset], sataphy[,reset],
# scttemp[sts,hist], scttempint,N[,p], scterc[,N,M], devstat[,N], defects[,N], ssd, gplog,N[,RANGE], smartlog,N[,RANGE], nvmelog,N,SIZE
smartctl -l error /dev/nvme0
smartctl -l selftest /dev/nvme0
